{
  "$schema": "../schema/daily-case-public.v1.schema.json",
  "schemaVersion": 1,
  "id": "daily-2026-07-19-sponsored-column",
  "publishDate": "2026-07-19",
  "locale": "zh-Hant-TW",
  "visibility": "public",
  "mode": "drill",
  "domain": "health",
  "title": "健康週刊的回春專欄",
  "canonicalSourcePaths": [
    "web/content/locales/zh-TW/drill.js",
    "modes/drill.md",
    "shared/structures.md"
  ],
  "content": {
    "kind": "choice-sequence",
    "items": [
      {
        "id": "sponsored-column",
        "chapter": "推理快問 04",
        "location": "灰橋讀書會・晨間閱覽室",
        "speaker": "林霧華",
        "role": "推理教練",
        "characterId": "lin_wuhua",
        "backgroundAsset": "web/assets/art/backgrounds/society-reading-room-dawn.webp",
        "briefing": "請評估這篇專欄能不能支持它提出的健康主張。除了文章內容，也要把作者身分、研究資助與可供查核的資料一起納入判斷。",
        "evidenceTitle": "健康週刊的回春專欄",
        "evidence": "《灰橋健康週刊》專欄〈銀杏素讓記憶力回春〉引述一項臨床實驗：「服用八週，記憶測驗成績進步 23%」。專欄最末一行小字寫著：本文作者是銀杏素品牌「憶康」的長期顧問；該實驗由憶康出資，沒有發表在任何期刊。",
        "prompt": "只根據目前提供的資料，這篇專欄對「銀杏素讓記憶力回春」的支持力該如何評估？",
        "options": [
          {
            "id": "A",
            "text": "可以直接採信：文章有實驗和具體數字，顧問身分不會影響研究結果。"
          },
          {
            "id": "B",
            "text": "完全不能採信：作者與廠商有利害關係，因此文中的數字一定是捏造的。"
          },
          {
            "id": "C",
            "text": "只能暫作線索：作者與資助者有利害關係，現有結果仍需獨立驗證。"
          }
        ]
      }
    ]
  }
}
