{
  "$schema": "../schema/daily-case-public.v1.schema.json",
  "schemaVersion": 1,
  "id": "daily-2026-07-13-unanswered-reply",
  "publishDate": "2026-07-13",
  "locale": "zh-Hant-TW",
  "visibility": "public",
  "mode": "scene",
  "domain": "public",
  "title": "還沒回覆的一方",
  "canonicalSourcePaths": [
    "web/content/locales/zh-TW/scene.js",
    "modes/scene.md",
    "shared/structures.md"
  ],
  "content": {
    "kind": "multi-lens-scene",
    "scene": {
      "location": "灰橋紀事報・晚間編輯室",
      "speaker": "程硯舟",
      "role": "現場記者",
      "characterId": "cheng_yanzhou",
      "backgroundAsset": "web/assets/art/backgrounds/graybridge-chronicle-pressroom.webp",
      "text": "晚間七點十二分，報社八點就要送印。總編羅薇決定把〈碼頭夜班事故增加〉放上頭版。記者程硯舟提醒：目前只有市府督察單位提供的數據，工人團體還沒回覆。發行主任說，上一次碼頭事故登上頭版後，當天新增訂閱數多了三成。羅薇說：「資料還不完整，但公共安全消息不能一直等。今晚先刊，文末清楚寫上『尚未取得工人團體回應』。」程硯舟沒有再回話，報社繼續準備送印。"
    },
    "lenses": [
      {
        "id": "frame_power",
        "label": "誰能做決定？",
        "reading": "羅薇有最後決定權。程硯舟提出疑問後沒有再說話，但光靠沉默，不能判定他同意。",
        "prompt": "你想先確認哪件事？",
        "options": [
          "誰可以暫停或更改頭版決定？",
          "記者提出異議後，還能透過什麼正式管道繼續反映？",
          "尚未回覆的工人團體，意見之後會怎麼補進報導？"
        ]
      },
      {
        "id": "frame_institution",
        "label": "哪些流程影響結果？",
        "reading": "八點送印的期限、頭版的決定方式和刊後更新規則，可能讓報社習慣先刊再補。這不一定是某個人故意造成的。",
        "prompt": "就算換一位總編，你想先檢查哪個流程？",
        "options": [
          "資料不完整時，報社在什麼情況下可以先刊？",
          "誰可以要求再查一次，或暫停送印？",
          "訂閱或發行表現是否會納入編輯決策？"
        ]
      },
      {
        "id": "frame_incentive",
        "label": "什麼因素推動選擇？",
        "reading": "這個決定可能同時受到三股力量影響：增加訂閱、搶先報導，以及及早提醒公眾。知道這些因素存在，不代表知道某個人的真正動機。",
        "prompt": "你想先查哪一股力量在這次決定中有多大影響？",
        "options": [
          "碼頭事故登上頭版後，是否通常會帶來更多新增訂閱？",
          "報社是否把「比別家早刊」當成表現目標？",
          "事故是否急到不能多等一個消息來源？"
        ]
      },
      {
        "id": "frame_charitable",
        "label": "最合理的善意解釋",
        "reading": "較善意的解釋是：羅薇知道資料不完整，但擔心延誤公共安全消息，所以選擇先刊，並清楚說明目前缺少哪一方的回應。",
        "prompt": "哪份資料最能檢查這個解釋是否站得住腳？",
        "options": [
          "市府數字是否經過基本查核，而且風險仍在持續？",
          "報社聯絡工人團體多久，並計畫何時更新？",
          "報社平常是否也用相同的緊急標準處理其他案件？"
        ]
      },
      {
        "id": "frame_info_limits",
        "label": "我們還不知道什麼？",
        "reading": "我們還不知道市府數字是否可靠、報社聯絡了多久、是否有其他消息來源，也不知道刊錯後會怎麼更正。",
        "prompt": "哪一份資料最可能補上目前最大的空白？",
        "options": [
          "原始事故資料、統計期間和計算方式",
          "報社聯絡工人團體的完整時間紀錄",
          "過去類似案件的刊登、延後與更正紀錄"
        ]
      },
      {
        "id": "frame_counter",
        "label": "什麼會讓你改變看法？",
        "reading": "這也可能是合理的時效決定，不一定代表報社偏袒任何一方。只看這一次會議，還不能證明報社長期偏向速度或商業利益。",
        "prompt": "先想想你目前比較傾向哪種看法，再選最可能讓你改變判斷的資料。",
        "options": [
          "如果你擔心商業壓力：過去類似案件都依公開的緊急標準決定版位，與訂閱表現無關。",
          "如果你支持立即刊登：第二個獨立來源發現市府數字有重大錯誤。",
          "如果你還沒下判斷：過去案件顯示，報社對不同消息來源採用不同查核標準。"
        ]
      }
    ],
    "positions": [
      "我比較擔心：趕時間和訂閱壓力，讓資料不完整變成常態。",
      "我暫時認為：這是為了及早提醒公眾，而且報導會清楚說明資料限制。",
      "目前資訊不夠。我需要先看到報社過去怎麼處理類似案件，再下判斷。"
    ],
    "commitments": [
      {
        "id": "A",
        "text": "今晚刊，但改成較小篇幅；清楚標示資料限制，並約定更新時間。",
        "objection": "即使篇幅較小，還沒查證完整的數字仍可能讓讀者先入為主；後續更新未必能消除第一印象。"
      },
      {
        "id": "B",
        "text": "暫緩刊登，等工人團體回應，或至少取得另一個獨立來源。",
        "objection": "如果對方一直不回覆，就等於能阻止報導；如果風險正在發生，等待也可能傷害公眾。"
      },
      {
        "id": "C",
        "text": "今晚照登頭版，但設定明確的複查期限，並公開後續更正紀錄。",
        "objection": "頭版帶來的影響可能遠大於文末的資料限制；事後更正也不一定追得上第一次報導。"
      }
    ]
  }
}
